"speaker","title","msg"
"Operator",NA,"Ladies and gentlemen, thank you for standing by. Welcome to the Target Corporation First Quarter Earnings Release Conference Call. [Operator Instructions] As a reminder, this conference is being recorded Wednesday, May 17, 2023.

I would now like to turn the conference over to Mr. John Hulbert, Vice President, Investor Relations. Please go ahead, sir."
"John Hulbert","Vice President, Investor Relations at Target","Good morning, everyone, and thank you for joining us on our first quarter 2023 earnings conference call. On the line with me today are, Brian Cornell, Chair and Chief Executive Officer; Christina Hennington, Chief Growth Officer; John Mulligan, Chief Operating Officer; and Michael Fiddelke, Chief Financial Officer.

In a few minutes, Brian, Christina, John and Michael will provide their perspective on our first quarter performance along with our outlook and priorities for the second quarter and beyond. Following the remarks, we'll open the phone lines for a question-and-answer session. This morning, we're joined on this conference call by investors and others who are listening to our comments via webcast. Following the call, Michael and I will be available to answer your follow-up questions.

And finally, as a reminder, any forward-looking statements that we make this morning are subject to risks and uncertainties, including those described in this morning's press release and our most recently filed 10-K. Also in these remarks, we refer to non-GAAP financial measures, including adjusted earnings per share. Reconciliations of all non-GAAP numbers to the most directly comparable GAAP number are included in this morning's press release, which is posted on our Investor Relations website.

With that, I'll turn it over to Brian for his thoughts on the first quarter and his priorities for the second quarter and remainder of the year. Brian?"
"Brian Cornell","Chair and Chief Executive Officer at Target","Thanks, John, and good morning, everyone. In the first quarter, our team's discipline and dedication to staying as simple [Phonetic] our guests drove results that met or exceeded the expectations we set at our financial community meeting back in February. Q1 total sales increased 0.5%, reflecting flat comparable sales at the midpoint of our guidance range, combined with the benefit of sales in new locations.

Profitability for the quarter was ahead of expectations. We came into the year clear eyed about what consumers are facing with persistent inflation and rising interest rates. And we were determined to build on the trust our guests have had in Target by unifying as a team to deliver affordable joy each and every day as consumers and businesses navigate a third straight year of dynamic challenges. We knew this year with demand, agility and team work and the ability to flex across our multi-category portfolio as we emphasize the categories our guests need most now. Well, our team did all of that in Q1, taking other step forward on our long term growth trajectory. I might point to three unbroken years of traffic growth as a proof point.

In the first quarter, comparable traffic grew 0.9% even as consumers were becoming more cautious in their overall shopping behavior. That's a healthy indication of the trust, loyalty and strategic relevance we've created. Especially given how much and how frequently consumers and the world circumstances have changed over those 12 straight quarters of traffic growth. Very few others can point to anything like that. This growth in guest engagement is the product of deliberate investments we've been making for many years. In all we do, we put the guest at the center, listening carefully to them and finding innovative ways to make their lives easier, more convenient and more joyful.

And here again, both the balance of our multi-category portfolio and the flexibility of our stores as hub model are helping us stay in step with our guests. The mix of in-store shopping has been growing for well over a year now as consumers have become increasingly comfortable in public places. This has led them to choose more in-store visits, causing in-store sales growth to outpace digital in the first quarter, both this year and a year ago. Notably, even within the digital channel, our same day services, which rely entirely on our stores, expanded more than 5% during the quarter. As usual, this increase was led by our drive up service, which saw growth in the high single digits. As more and more of our guests embrace the speed, convenience and reliability it provides. In total for the quarter, more than 97% of our sales were fulfilled by our stores.

As it did throughout last year, pressure from inflation and rising interest rates affected the mix of retail spending in Q1. With a further softening in discretionary categories in the March and April time frame. This coincided with the deterioration in consumer confidence reflecting recent events such as the banking crisis that emerged in March. These continued signs of caution among consumers have reinforced why we entered this year with a conservative inventory position. And as Michael will cover in more detail, we maintained that cautious stance throughout the first quarter and feel good about our current positioning in light of the trends we've been seeing.

But as Christina will highlight in a few minutes, our cautious posture has not reduced our commitment to offering fresh, on trend merchandise throughout the year. We know that newness is a critical element of what our guests expect when they shop with us. And even if they manage their household budgets and make disciplined buying choices, our guests continue to respond when we offer the right combination of newness, trend right fashion, and affordability. That's what we mean when we talk about affordable joy. It's something that's core to our brand and a key differentiator in the marketplace.

Beyond macroeconomic challenges, we continue to contend with significant headwinds caused by inventory shrink, building on a worsening trend that emerged last year. While shrink can be driven by multiple factors, theft and organized retail crime are increasingly urgent issues, impacting the team, and our guests and other retailers. The problem affects all of us, limiting product availability, creating a less convenient shopping experience, and putting our team and guests in harm's way. The unfortunate fact is, violent incidents are increasing at our stores, and across the entire retail industry. And when products are stolen, simply put, they're no longer available for guests who depend on them. And left unchecked, theft, and organized retail crime to grade the communities we call home.

As we work to address the problem, the safety of our guests and our team members will always be our primary concern. As a result, we are engaged in a variety of mitigation efforts, which begin with significant resource investments to protect our team and our guests. In addition, we're installing fixtures to protect merchandise and adjusting our assortment in affected stores. Beyond safety concerns, worsening shrink rates are putting significant pressure on our financial results.

More specifically, based on the results we've seen so far this year, we expect that shrink will reduce our profitability by more than $0.5 billion compared with last year. And while we're doing all we can to address the problem, it's an industry and community issue that can't be solved by a single retailer. That's why we're actively collaborating with legislators, law enforcement, and retail industry partners to advocate for public policy solutions to combat [Phonetic] organized retail crime.

As we communicate with those partners, we emphasize that we're focused on keeping our stores open in the markets where problems are occurring. Our source grade jobs serve local shoppers and act as critical hubs in communities across the country. And we'll continue to do everything in our power to keep our doors open. At the same time, we'll be closely monitoring the safety of our team and guests. As well as the financial impact to our business as we determine the right path forward at Target.

Even as we navigate through multiple short term challenges, we remain focused on making Target stronger and better for all our stakeholders over the long term. Right now, our team is rallying around a focus on retail fundamentals to ensure we're staying reliable and affordable for our guests, and that were translating key points of difference, like our physical proximity to the vast majority of US shoppers. And our emphasis on a joyful guest experience into unmatched ease and inspiration for our guests as we continue to grow and scale.

We're also intently focused on creating easier and more efficient ways for our team to deliver on our strategy and fuel our ongoing growth ambitions. Underpinning all of this is our continued commitment to disciplined, return based investments that will benefit stakeholders, both today, and well into the future.

This goes well beyond our physical capital. As John will outline, we'll continue to make important investments in our team. This begins, of course, by building on the robust investments in wages and benefits we've made in recent years. Because of those past investments, today we offer starting wage range of $15 to $24 across the country. We significantly enhance the health and wellness benefits we provide and tens of thousands of our team members are enrolled in our industry leading debt free college educational program. But our efforts extend well beyond the wages we pay and the benefits we offer. We are committed to building a culture growth providing our team with strong foundational learning, enhancing their skills, and preparing them to excel not just at their current role, but their next role on the Target team as they continue to build a rewarding career with us.

I want to close my remarks by thanking our team. Nothing is more energizing than the time I spend with them. From visits to our stores and distribution centers across the country, to the time I recently spent with our headquarter team in Bangalore, India. Our team is proud to work at Target, and they show that pride through their actions every day, all in support of our guests. I'm proud to work alongside them, and it's a privilege to represent their efforts in venues like these.

With that, I'll turn the call over to Christina."
"Christina Hennington","Executive Vice President and Chief Growth Officer at Target","Thanks, Brian, and good morning, everyone. In many ways, the themes of the first quarter operating environment were very similar to what we've outlined in recent quarters. So it likely comes as no surprise that we continue to face elevated volatility and see a reprioritization of spending away from discretionary categories in the face of persistent inflation in groceries and essentials.

Despite the near term challenges facing the retail industry and our business, we remain confident in our ability to generate long term results. Largely driven by the unwavering commitment displayed by the Target team to our guests, each other and the communities where we operate. Guests continue to place their trust on Target, choosing to shop with us more and more often at a time when consumers are hyper focused on managing their budget.

As Brian mentioned, American consumers continue to face difficult trade off decisions as they juggle the wants and needs of their families. Consumers saving rates are down and while inflation rates are finally declining, so is consumer confidence. The fear of a looming recession weighs heavily on many American families, and though discretionary spending remains soft, our guests are still looking to sprinkle some affordable joy into their regular shopping at Target.

In the first quarter, comparable sales were flat to last year, which was squarely at the center of our expectations. As you heard from Brian, we continue to benefit from traffic and sales growth in our frequency categories, food and beverage, household essentials, and beauty, which help to offset softer year-on-year sales in our more discretionary home, apparel, and hard lines categories.

Within the quarter, total sales were strongest in February, began decelerating in March and soften further near the end of April. Q1 performance was led by Beauty, which delivered comp growth in the mid-teens, in light of continued strength in both Core Beauty and Ulta Beauty at Target assortment. Food and beverage grew in the high single digits, reflecting broad based strength across the category.

Household Essentials delivered low single digit growth reflecting notable strengths in both the health and pet care categories. Apparel, home and hard lines, all experienced sales declines from the mid-single digits to low double digits as guests continue to pull back on discretionary purchases. Notably, guests are shifting to shop more just in time in these categories as they wait until the last moments before key events to invest in new decor or wardrobe refreshes.

As we've been noting for some time, despite overall softness in discretionary categories, seasonal moments and newness in apparel, home and hard lines continue to be bright spots, prompting great responses from our guests. Within the first quarter, we have strong Valentine season and Easter holiday across multiple assortments ranging from food and hosting solutions to decor and giftables.

New offerings in apparel, including the latest wave of our designer dress collection, and new sets in women's athleisure have seen incredible responses from guests. And this year's major theatrical releases such as Super Mario Brothers and the upcoming Disney film, The Little Mermaid, are driving outsized share gains and sales momentum. These examples demonstrate that when our assortments are fresh, seasonally relevant, and affordable, that's a winning formula to engage and delight our guests.

Given that consumers are cautious when buying discretionary items, we are being more declarative than ever about affordable joy and leaning into value messaging across all our media channels, in-store signing, merchandise displays, and through our digital platforms. With a balance of strong opening price points, timely and relevant promotions, as well as a mix of competitively priced national brands and high quality and affordable own brand offerings, we have an opportunity to boldly demonstrate the power of Target's value proposition to our guests. As I've shared in prior calls, this is where the power of Roundel and Target Circle really shine through, creating collective value for our guests and for Target.

With consumers more price conscious and focused on promotions right now, we know they're willing to search for a deal, but appreciate when we make the hunt easy for them. By utilizing our rich guest insights, we are best able to match the right product to the right guests with the right promotion. This is why we take such a differentiated approach with Roundel, thoughtfully and selectively connecting vendors and their products to our guests. Roundel's interconnection with the broader Target's [Phonetic] digital ecosystem means we are uniquely positioned to inspire the millions of users of our website, the Target app and other diverse media platforms. This helps vendors find consumers that are most likely to be interested in their products, creates awareness and conversion to new products for our guests, through compelling deals and ads, and drives top line and bottom line benefit to Target. All with an eye to enhancing the guest experience.

Similarly, we know this personalized touch is why active Target Circle users make two-and-a-half times the trips in Q1 compared to non-circle guests and spent three times more. Whether through everyday offers or member exclusive events like Target Circle Week in March, we see incredible guest response to Target Circle promotions. Roundel and Target Circle provide opportunities for us to connect with guests in both the short and long-term, offering instantly gratifying promotions in the now and a tailored and elevated experience that builds lasting affinity tomorrow and beyond. And beyond promotions and product placements, we know that when guests try our own brand offerings, they love the value and quality they receive, and this leads to repeat purchases.

We also know that simplified, easy to understand pricing promotion removes friction from the shopping experience, both in stores and online. This explains why our guests are responding to affordable home decor selections, where we are expanding our assortment of items priced under $10. It's why we recently launched new swim assortments starting at just $12 and to help our guests get ready for summer celebrations of all kinds, our only at Target Sun Squad brand offers everything needed to be outside this summer. With more than 60% of the entire assortment priced under $10, and nearly 90% of the assortment priced under $20. But our comprehensive view of affordability extends beyond compelling price points.

In particular, our own brand portfolio offers an unmatched combination of quality and price. For an example, look no further than our $3 billion owned brand Cat & Jack, featuring on trend, durable, and affordable kids' clothing. With everyday essentials like $4 t-shirts, $5 leggings and $8 dresses and jeans, Cat & Jack offers both affordability and style. And because we stand behind not just the price, but the quality of these items as well, we guarantee all Cat & Jack apparel for one full year with three returns should anything not meet our guest expectations. This is just another example of how we offer comprehensive value for our guests, giving them affordable options without skimping on quality.

As we look to the second quarter and beyond, we will continue the steady drumbeat of newness and value, all while maintaining a cautious inventory ownership position in our discretionary categories. In terms of seasonal moments and holidays, Target teams are focused on helping our guests celebrate all summer long. Starting last weekend, we kicked things off by celebrating Mother's Day with affordable and inspiring ways to thank the moms in our lives. And we have plans to continue celebrating key summer moments all quarter long, wrapping up with everything needed to host the perfect fourth of July barbecue.

With new summer food and beverage offerings, including more than 100 new good and gather items, to Target exclusive pickup offsets [Phonetic] for amateurs and pros alike, we are listening closely to our guests and providing the hottest trends across our entire assortment. In apparel, guests will find vibrant color palettes across our offerings, helping all families celebrate summer in style. Best of all, these apparel items provide amazing value with clear, compelling opening price points.

For kids and kids at heart, the summer's roster of exciting movie blockbusters will find their way into multiple assortments, ranging from apparel to toys to collectibles, featuring familiar characters from Disney, Marvel, Teenage Mutant Ninja Turtles, and more. And because you can never have too much of a good thing, the latest assortment drop from Tabitha Brown just launched a few days ago. Already off to a fabulous start, this collection celebrates the joy that comes from gathering alongside friends and family, recharging in the summer sun and pausing for fun and games.

The assortment includes over 60 items ranging from backyard entertaining essentials, games, tableware, outdoor furniture, as well as guest favorite food items backed by popular demand. As we navigate this challenging environment, we will continue to lean into flexibility and focus on retail fundamentals, while remaining vigilant in monitoring, changing trends with the consumer and the economy. It's only because of our incredible team that we are able to stay nimble, listening for and quickly applying guest feedback into our operations for our teams and stores, supply chain and headquarters locations around the world. Thank you for sharing your talents and passion and support of our guests. You are truly the best team in retail, and you bring Target's values to life each and every day.

With that, I'll turn the call over to John."
