"speaker","title","msg"
"John J. Mulligan","Executive Vice President and Chief Operating Officer at Target","Thanks, Christina. Through all of the rapid and unexpected changes we've experienced over the last three years, teams throughout our operations have done an amazing job, maintaining their energy, staying agile and doing everything in their power to serve our guests ever changing needs. And today with two years of unusually rapid growth behind us and last year's excess inventory in the rearview mirror, we are focusing this year on training and development for our team with an emphasis firmly centered on retail fundamentals.

Our goal is to reinforce the reliability and consistency of our shopping experience as we help our team members to succeed in their current job and build the right skills to prepare for the next one. More specifically, every store this year is engaging in assessments to reinforce consistently strong execution throughout the country and every day of the year. These assessments are centered on the factors most essential to operating great stores and delivering a consistent experience ranging from staffing and scheduling to inventory management, in-store signing, digital fulfillment, guest and team member safety, and the checkout experience.

In support of these efforts, we're investing in training and development across every level of our team, from entry level team members to the store leaders. Beyond the reinforcement of everyday best practices, we're preparing our team to support new services, including the upcoming rollout of drive up returns and the opening of additional Ulta Beauty at Target locations. In addition, to develop our store supervisors and leaders, we're investing in a cohort based peer learning model in which participants engage in classroom experiences, one-on-one coaching and on the job practice. All of this training is designed to help our team succeed today and build our pipeline of future leaders.

Of course, a foundational element of our team development effort is our education assistance program called Dream to Be, which enables our US based part time and full time team members to pursue tuition free undergraduate and associate degrees, certificates and boot camps. This industry leading program features tuition free options in more than 250 business aligned programs across more than 40 schools, colleges and universities. Since the rollout of Dream to Be in 2021, tens of thousands of our team members have successfully participated in this program.

As you saw in today's release, we ended the first quarter with 16% less inventory than a year ago. This decrease reflects our current, cautious position and discretionary categories, combined with the impact of excess inventory on last year's balance sheet. Those factors are being partially offset by some purposeful inventory investments. These include investments in support of our frequency categories. In light of the rapid growth we've been seeing and to ensure we're in stock. And I'm happy to say that these investments have been paying off.

In the first quarter, out of stocks of our most important food and beverage and essentials items were running at three-year lows and trending in a favorable direction. In addition to support of our frequency businesses, we're also making strategic inventory investments where we believe we have a long term market share opportunity. Most notably, in the upcoming back to school and back to college seasons.

As you know, in our supply chain, we're engaged in a multi-year journey to modernize how we replenish inventory in our stores. When I moved into this position eight years ago, store inventory replenishment was a standardized inflexible process that placed a heavy burden on our store team members. With this modernization effort, our primary goal is to reduce those labor demands on our stores. We achieved that result by moving work upstream to a distribution center where we can apply the appropriate processes, technology, tools and automation to accomplish the work at scale. This results in higher labor efficiency for the company overall, while allowing our store team members to spend more time in the front of our stores with our guests.

In the upstream distribution centers we've opened over the last two years, we've implemented technology and capabilities that improve how product is sorted and loaded onto trailers headed for our stores. These improvements reduce the necessary time for the store team to unload the trailer and for them to move the inventory to where it's needed in the store. In these new buildings, we've also invested to automate the sortation and packing of break pack items, facilitating the shipment of quantities smaller than a full case pack. This automated process makes the shipment easier to unload, reduces sorting time for the store team and lowers the amount of inventory in our store backrooms. Outside of our new facilities, we're working to rollout similar capabilities to our legacy distribution centers.

In addition, throughout our legacy network, we continue to focus on reducing the overall cost of store replenishment by implementing automation along with other improvements. For example, we've been testing ways to improve the lead time and accuracy of our deliveries from several of our existing buildings and have seen an increase in speed and lower out of stocks in stores service from these facilities. But I want to stress, automation is only one way to deliver value to our business. Consider our sortation centers, which are positioned downstream from our stores to provide speed and efficiency in support of last mile delivery. Our sort centers are not highly automated. Instead, they use technology and sophisticated process logic to sort packages and provide a faster and better guest experience at a significantly lower cost.

In fact, it's because of the relative simplicity in the design of these buildings and the efforts of an incredibly innovative and energetic team that we've been able to scale the number of these buildings so quickly. From three a year ago to nine today, and an expected total of 15 or more in 2026. Beyond rapidly scaling the number of sort centers, our team continues to innovate around the existing processes in those buildings, finding ways to deliver additional value to the business. One example is a new facility that we opened earlier this month in Smyrna, Georgia. This new facility which costs very little to open serves as an extension of the existing sortation center in the Atlanta market, extending the reach of our next day delivery capability.

With this new facility, online orders that have been packed by Atlanta area stores continue to flow to the sortation center, where they're sorted and delivered via our national carrier partners or a ship driver. However, a portion of local orders falling outside the sortation center's last mile delivery area can now be transferred to the Smyrna extension, where ship drivers can pick them up and serve additional neighborhoods. With the opening of this extension facility, our next day delivery capability is now reaching more than 3 million guests in the Atlanta market.

As we mentioned at our recent financial community meeting, in our Dallas and Minneapolis sortation centers, Target and shipped have been testing the development of high capacity van routes that enable us to bring last mile delivery to a larger number of guests. In addition, over the past year, across all of our markets served by our sortation centers, we have shifted more routes to larger passenger vehicles and early results have been positive. Compared with routes previously served by sedans, SUVs and minivans can deliver more than double the number of packages per route. Our high capacity vans can service nearly five times as many packages.

And beyond capacity, the use of larger vehicles enables further route optimization, increasing the number of packages that can be delivered per hour. With these changes, in the first quarter approximately 65% of our last mile deliveries serviced by Shipt were made with larger vehicle compared with zero a year ago. This resulted in meaningful cost savings for our last mile delivery program overall. Based on the success of these efforts, we're developing plants to begin testing high capacity vans at a larger scale.

In addition, we're developing a standardized faster way to load those vans, enabling package containerization and easy identification of the correct packages at delivery. In addition to simplifying the load process for the drivers, this new process will enable us to safely move a larger number of ship drivers in and out of our sort centers in a given amount of time, expanding our last mile delivery capacity in these markets.

While there are many different ways our team is working to gain efficiencies and deliver value to the business, all of our projects have some things in common. First and foremost, they're all designed and implemented with the focus on our guest and continuing to build their engagement with Target. In keeping with that guest focus, we design processes and deploy technology and automation as a way to highlight the human element in our business rather than minimizing it. It's an essential element of our purpose to help all families discover the joy of everyday life.

As I get ready to close, I want to pause and thank our team for bringing that purpose to life every day, for both our guests and for your fellow team members. You are the reason that guests trust and love our brand and why they choose to shop at Target.

With that, I'll turn it over to Michael."
"Michael Fiddelke","Executive Vice President and Chief Financial Officer at Target","Thanks, John. In many ways, the environment today feels completely different than three years ago when the pandemic was just beginning and no one knew what to expect. But today, even as the pandemic feels further and further behind us, we continue to face elevated macro uncertainty and volatility as the world continues the transition toward a new normal.

From a macro perspective, inflation remains high and stubbornly persistent having recently peaked at decades high levels. To control this inflation, the Federal Reserve has been raising interest rates at an unprecedented pace. But for now, despite the building economic pressure from both inflation and higher interest rates, the US unemployment rate is lower today than it's been in 50 years. And as Christina mentioned, consumer spending patterns continue to evolve, putting significant pressure on our discretionary categories.

While I'm guessing we're all looking forward to the day when economic conditions begin to stabilize and normalize, I'm pleased that today, even in the face of all these challenges we're continuing to see deeper engagement from our guests. That's most visible on our traffic, which grew just under 1% in Q1 and has now grown for 12 consecutive quarters. In fact, since 2019, prior to the pandemic, first quarter total sales have increased more than 43%. The vast majority of that growth is the result of an increase in sales per square foot over that time, of which a significant portion has been driven by traffic.

Total sales grew 0.5% in the first quarter, reflecting flat comparable sales combined with the contribution from new locations. Total revenue growth of 0.6% reflected sales growth combined with double digit growth on the other revenue line, led by our Roundel ad business. As Brian mentioned, sales trends softened over the course of the first quarter. More specifically, we began the quarter with positive comp growth in the month of February and then saw the trends soften into low single digit declines by the end of April and so far into May.

Our first quarter gross margin rate of 26.3% was about 60 basis points higher than a year ago. Among the drivers, we saw more than a percentage point of favorability in merchandising driven primarily by reduction in freight and transportation costs. Along with the benefit of retail pricing and a lower clearance markdown rate as we compared over last year's inventory actions. We also saw a small gross margin rate benefit from lower digital volume and a more favorable mix of lower cost same day fulfillment.

Offsetting those two sources of benefit, shrink reduced our gross margin rate by a full percentage point compared with a year ago. As Brian highlighted, pressure from shrink has continued to increase and we now expect that if current trends continue, shrink will reduce our full year profitability by more than $500 million compared with last year. One note, the impact of merchandise mix on our first quarter gross margin rates was approximately neutral, as the rate impact of sales declines in our highest margin categories was offset by sales declines in lower margin rate categories.

Consistent with the guidance we provided for the quarter, our first quarter SG&A expense rate was 19.8% up about 90 basis points from a year ago. This increase reflects our continued purposeful investments in pay and benefits for our team, combined with inflationary cost pressures throughout our business, against a backdrop of flat comparable sales, partially offset by the benefit of productivity increases and strong expense discipline across the company.

Our first quarter DNA expense rate was down about 10 basis points, reflecting lower accelerated depreciation related to our remodel program compared with last year. Altogether, our first quarter operating income rate of 5.2% was higher than expected due primarily to upside in our gross margin rate as the benefits from lower freight and transportation costs and our efficiency efforts offset a higher than expected impact from shrink.

As John mentioned, Q1 ending inventory was about 16% lower than a year ago. Within that inventory number was a decline of more than 25% in discretionary categories, reflecting the excess inventory we were carrying last year and the cautious approach we are taking this year. Partially offsetting the decline in discretionary inventory are the purposeful inventory investments we're making in our frequency categories along with some strategic bets in support of long term share opportunities. We believe our cautious inventory approach has served us well so far this year and will continue to be the right approach going forward.

As I turn now to capital deployment, I'll start where I always do, by reiterating our long standing priorities. First, we fully invest in our business in projects that meet our strategic and financial criteria. Second, we support the dividend and look to build on our record of annual increases, which we've maintained since 1971. And third, only after we've supported those first two priorities, we deploy any excess cash to repurchase shares over time within the limits of our Middle A credit ratings.

Regarding the first priority, we made capital investments of $1.6 billion in the first quarter as we continue to remodel stores, open up new locations, build upstream inventory replenishment capacity and ramp up our sortation center strategy. With one quarter of the year behind us, we continue to expect our full year capex will be in the $4 billion to $5 billion range.

Regarding the second priority, we paid dividends of $497 million in the first quarter, up from $424 million last year, driven by a 20% increase in the per share dividend partially offset by a decline in average share count. And finally, given the impact of the current environment on our financial performance, we didn't repurchase any shares in the first quarter. In the near term, we'll maintain that approach and don't intend to resume repurchase activity until it's compatible with our long term credit rating goals.

On that note, I'm pleased with our progress in strengthening our balance sheet. Even as profitability remains well below our long term potential, we've already seen an encouraging improvement in our operating cash flows. More specifically, our operations generated $1.3 billion of cash in Q1, and start comparison to a year ago when our operations absorbed $1.4 billion. This dramatic year-over-year improvement was driven almost entirely by changes in our inventory investment compared with last year.

And finally, I want to end my review of the quarter with our after tax return on invested capital. For the trailing 12 months, through the first quarter of this year, our after tax ROIC was 11.4% compared with 25.3% a year ago, reflecting both the change in profitability and the increase in working capital we began to see a year ago. As we move farther into the year, we expect to see higher profitability than a year ago and continue to benefit from the inventory efficiency reflected in this quarter's cash flow. Based on these expectations, we anticipate a recovery in the ROIC metric this year and expect to continue building back toward our longer term potential in 2024 and beyond.

So now, let me turn to our expectations for Q2 and the full year. As I mentioned on the sales line, we experienced notably softer comp trends as we exited the first quarter and moved into May. As a result, we're anticipating second quarter sales in a wide range centered around a low single digit decline, consistent with those recent trends.

In terms of profitability, we're expecting a range of possibilities as well. On the gross margin line, we believe that many of the same trends that emerged in Q1 will continue in the second quarter, including a meaningful tailwind from freight and transportation costs and a significant headwind resulting from inventory shrink. Similarly, on the SG&A expense line, we'll continue to face broad based inflationary pressures and expect to benefit from efficiency efforts and cost discipline across our team.

However, if our second quarter comp sales end up declining in the low single digits, which is where they are trending currently, we'll see greater SG&A rate pressure related to cost deleverage than we experienced in Q1. In light of all of these expectations, we believe our Q2 operating margin rate will be much higher than the very low rate we earned a year ago, but lower than the 5.2% we saw in Q1. Altogether, our expectations translate to a second quarter GAAP and adjusted EPS range of $1.30 to $1.70.

As we look beyond Q2, we continue to believe that we entered this year with the appropriate level of caution, planning conservatively in light of a tough macro environment and rapidly changing consumer trends. While we're facing some clear headwinds in the short term, we also have multiple actions underway to mitigate them, including ongoing efficiency work and cost saving efforts that we expect to flow into the P&L in the second half of the year. While we feel good about these efforts, we also remain cautious on the overall environment, in light of the macro and shrink pressures we've outlined today.

Taking this all into account, we are maintaining the full year guidance we provided at our financial community meeting in February. Namely, we're planning for full year comparable sales in a wide range centered around flat. We expect to grow our full year operating income by $1 billion or more. And we expect our business to generate full year GAAP and adjusted EPS of $7.75 to $8.75.

As I get ready to turn the call back over to Brian, I want to reiterate my confidence in our longer term prospects for profitable growth. Even today, against a very challenging backdrop, we're starting to assemble the building blocks for a recovery in our operating margin rate back toward its longer term potential. And while spending pressures in discretionary categories are currently outweighing the continued strong growth we've seen in our frequency categories, we're confident that the economy and the consumer will stabilize over-time and will once again benefit from growth in the more discretionary portion of our assortment. In the meantime, we have the capacity to navigate this environment with a strong balance sheet and a resilient business model. We have the right long-term strategy and were privileged to work with the best team in retail. I want to express my sincere thanks to our entire team. You are by far our most valuable long-term asset.

With that, I'll turn it over to Brian."
"Brian Cornell","Chair and Chief Executive Officer at Target","As Michael just mentioned, we don't build our strategy based on a single moment, but focus on the best way to serve our guests over-time. We take that approach when we invest in our stores, in our supply chain, in digital fulfillment, and our team. And as we've said many times, we also build our assortment to serve the long term needs of our guests, and the benefit of this flexible assortment strategy has been clearly evident over the last few years.

Following the onset of the pandemic, we saw unprecedented traffic and sales growth in our discretionary categories. And now this year, even as guests are pulling back on discretionary purchases, we still grew traffic just under 1% in the first quarter as guests increased their spending in beauty, food and beverage, and household essentials. But a short-term pullback in discretionary purchases doesn't mean we'll turn away from our apparel, home and hardline categories. Instead, we'll continue to invest in them and deliver fresh new items throughout the year. That's because our guests continue to love these categories and we're focused on building our guest engagement with them. Think about it this way. When I arrived at Target just under nine years ago, our food and beverage category was underperforming and losing market share. But rather than turning away from that part of our business, we decided to lean in. We committed to the long-term and engaged in the hard work that we needed to improve our performance, ranging from our relationship with vendors, to our fresh food supply chain, strong labor model, assortment strategy, and our own brands. Much of that work happened behind the scenes, and it took time before business trends and food and beverage started to change, but the work paid off over time. We entered 2023 following three straight years of unprecedented growth and market share gains in food and beverage, having grown that category by more than 61% between Q1 2019 and this year's first quarter.

Beauty is another category where past investments are paying off. It's been performing well for years, because we continually invested in the store experience, in passionate, talented, and well trained team members, in our digital experience, and our assortment. Our growing partnership with Ulta Beauty is the latest example of how we're finding innovative ways to further enhance our beauty assortment and experience and our business results clearly demonstrate that our investments are paying off. We've experienced double digit growth in Beauty sales for the last three years in a row, and just saw mid-teen growth in the first quarter. These examples demonstrate why we're investing and maintaining a long-term focus across the board on every one of our merchandising categories, fulfillment options, stores, services, and our team, all-in service to bringing affordable joy to our guests. If we do that right, we'll always be ready to serve our guests as their needs change, further deepening our long-term relationship with them.

With that, we'll move to Q&A. Christina, John, Michael and I will be happy to take your questions."
"Operator",NA,"Thank you. We will now begin the question-and-answer session. [Operator Instructions] Our first question comes from Ed Kelly with Wells Fargo. You may go ahead."
"Edward Kelly","Analyst at Wells Fargo Securities","Hi, guys. Good morning. I wanted to start with the guidance. I mean, clearly you're beginning to see increased consumer pressure now in Q2. I think there are signs of weakening are broad out there, but the midpoint of your guidance implies a pretty good back half improvement. I'm just kind of curious how you thought about Q2 with the reaffirmation of a full year and is it realistic for us to think that the back half would be in the low $2 range given what Q2 guidance is? Thank you."
"Brian Cornell","Chair and Chief Executive Officer at Target","I'll let Michael start by talking about Q2 and then I'll talk about our focus on the balance of the year."
"Michael Fiddelke","Executive Vice President and Chief Financial Officer at Target","Yeah. Thanks for the question. You said part of the answer right in your question. We continue to take a cautious approach to the top line. We think that served us really well in the first quarter. One of the reasons we got the profit outcome we did in the first quarter is that with inventory positioned conservatively that gives us flexibility and agility. And so you'll continue to see us take that posture for the balance of the year. And that comes with an impact on the top line and the bottom line. Our leverage looks different at a slightly negative comp than it does when we're running a positive comp. A couple of other things that I dimensionalize kind of in how they'll paginate over the year though. One is shrink, with the current trends continuing that year-over-year pressure from shrink is certainly front half loaded in the year. And so you see that impact in Q2 as well. And then we're excited about the continued work on our efficiency initiatives and you'll see some of that come to bear in the back half of the year too. So taking that altogether, we feel good about the full year positioning and we're appropriately cautious for the second quarter."
